{
  "$schema": "http://json-schema.org/draft-07/schema#",
  "type": "array",
  "items": {
    "type": "object",
    "required": [
      "slug",
      "title",
      "date",
      "lang",
      "category",
      "keywords",
      "description"
    ],
    "properties": {
      "slug": { "type": "string" },
      "title": { "type": "string" },
      "date": { "type": "string" },
      "update": { "type": "string" },
      "lang": { "type": "string" },
      "category": {
        "type": "string",
        "enum": ["技术", "备忘", "杂记", "小札", "闲话", "杂项"]
      },
      "keywords": {
        "type": "array",
        "items": { "type": "string" }
      },
      "description": { "type": "string" }
    },
    "additionalProperties": false
  }
}
