[
  {
    "slug": "macos",
    "title": "Moroshima 的奇怪 macOS 命令集",
    "date": "2023-12-10T01:24:02",
    "update": "2024-02-13T07:01:29",
    "lang": "zh-Hans",
    "category": "备忘",
    "keywords": ["macOS", "shell"],
    "description": "杂七杂八收集的一些奇怪 macOS 工具与命令。"
  },
  {
    "slug": "debian-sid-guide",
    "title": "Debian GNU/Linux sid 折腾指北",
    "date": "2023-05-16T15:16:46",
    "update": "2023-10-12T23:29:01",
    "lang": "zh-Hans",
    "category": "技术",
    "keywords": ["Linux"],
    "description": "如何安装 Debian GNU/Linux sid。"
  },
  {
    "slug": "routing-design-philosophy",
    "title": "SPA 路由设计哲学",
    "date": "2022-11-08T15:08:06",
    "update": "2023-05-11T21:16:38",
    "lang": "zh-Hans",
    "category": "技术",
    "keywords": ["开发", "前端"],
    "description": "关于单页面应用程序的路由设计哲学。"
  },
  {
    "slug": "low-cost-aimesh-networking",
    "title": "低成本 AiMesh 组网小记",
    "date": "2022-07-01T15:49:03",
    "update": "2022-08-02T03:08:51",
    "lang": "zh-Hans",
    "category": "备忘",
    "keywords": ["网络"],
    "description": "一篇关于家庭 AiMesh 如何搭配组网的短文。"
  },
  {
    "slug": "how-to-update-dot-gitignore",
    "title": "更新 .gitignore 的正确姿势",
    "date": "2022-04-22T21:16:46",
    "update": "2022-08-02T03:09:31",
    "lang": "zh-Hans",
    "category": "技术",
    "keywords": ["开发", "Git"],
    "description": "如何以一个正确的姿势更新 .gitignore。"
  },
  {
    "slug": "book-list",
    "title": "Book List",
    "date": "2022-04-02T14:52:04",
    "update": "2022-08-02T03:10:01",
    "lang": "zh-Hans",
    "category": "杂项",
    "keywords": ["文学"],
    "description": "看看我最近读了些啥书 (❁´◡`❁)"
  },
  {
    "slug": "how-to-standardize-commit-messages",
    "title": "规范项目的代码提交信息",
    "date": "2022-02-19T05:59:01",
    "update": "2022-08-02T03:10:15",
    "lang": "zh-Hans",
    "category": "技术",
    "keywords": ["Git", "工程化"],
    "description": "如何在一个工程化项目中规范代码提交信息。"
  },
  {
    "slug": "c-structure-study-notes",
    "title": "结构体学习笔记",
    "date": "2020-12-22T14:52:00",
    "lang": "zh-Hans",
    "category": "备忘",
    "keywords": ["C", "学习笔记"],
    "description": "有关于 C 语言中结构体部分难点的汇总与整理。"
  },
  {
    "slug": "cut-through-the-fog",
    "title": "「斬霧破竹」",
    "date": "2022-05-29T13:32:18",
    "lang": "zh-Hans",
    "category": "闲话",
    "keywords": ["老婆"],
    "description": "「斬霧破竹」"
  },
  {
    "slug": "kazuha",
    "title": "万葉",
    "date": "2022-02-20T03:32:18",
    "lang": "zh-Hans",
    "category": "闲话",
    "keywords": [],
    "description": "万葉"
  },
  {
    "slug": "test",
    "title": "test",
    "date": "1970-01-01T00:00:00",
    "lang": "en",
    "category": "杂项",
    "keywords": [],
    "description": ""
  }
]
